{
  "schema_version": 2,
  "id": "milesmusickid",
  "name": "Miles Bonham",
  "location": {
    "city": "Unknown",
    "country": "Unknown"
  },
  "styles": [],
  "links": {
    "source": "https://instagram.com/milesmusickid",
    "instagram": "https://instagram.com/milesmusickid"
  },
  "tattoos": [],
  "updated_at": "2026-04-26",
  "discovery": {
    "source": "instagram_graph",
    "followed_by_count": 2,
    "similar_to_count": 0,
    "evidence_count": 2,
    "followed_by_known_artists": [
      "abkillem13",
      "adamfox"
    ],
    "similar_to_known_artists": [],
    "instagram_id": "37284252631"
  }
}