{
  "schema_version": 2,
  "id": "byynorah.hq",
  "name": "byynotah.hq",
  "location": {
    "city": "Unknown",
    "country": "Unknown"
  },
  "styles": [],
  "links": {
    "source": "https://instagram.com/byynorah.hq",
    "instagram": "https://instagram.com/byynorah.hq"
  },
  "tattoos": [],
  "updated_at": "2026-04-26",
  "discovery": {
    "source": "instagram_graph",
    "followed_by_count": 0,
    "similar_to_count": 3,
    "evidence_count": 3,
    "followed_by_known_artists": [],
    "similar_to_known_artists": [
      "cindycardwell",
      "criskd",
      "watchoutforme"
    ],
    "instagram_id": "79903181654"
  }
}