{
  "schema_version": 2,
  "id": "wolfsteintattoostudio",
  "name": "WOLFSTEIN STUDIO",
  "location": {
    "city": "Unknown",
    "country": "Unknown"
  },
  "styles": [],
  "links": {
    "source": "https://instagram.com/wolfsteintattoostudio",
    "instagram": "https://instagram.com/wolfsteintattoostudio"
  },
  "tattoos": [],
  "updated_at": "2026-04-26",
  "discovery": {
    "source": "instagram_graph",
    "followed_by_count": 0,
    "similar_to_count": 2,
    "evidence_count": 2,
    "followed_by_known_artists": [],
    "similar_to_known_artists": [
      "adrianlazo613",
      "ericryantattoos"
    ],
    "instagram_id": "65191616707"
  }
}