{
  "schema_version": 2,
  "id": "miguelangelo_tattooer",
  "name": "Miguel Pedroso",
  "location": {
    "city": "Unknown",
    "country": "Unknown"
  },
  "styles": [],
  "links": {
    "source": "https://instagram.com/miguelangelo_tattooer",
    "instagram": "https://instagram.com/miguelangelo_tattooer"
  },
  "tattoos": [],
  "updated_at": "2026-04-26",
  "discovery": {
    "source": "instagram_graph",
    "followed_by_count": 0,
    "similar_to_count": 2,
    "evidence_count": 2,
    "followed_by_known_artists": [],
    "similar_to_known_artists": [
      "ariefasant",
      "igorgama"
    ],
    "instagram_id": "43538175648"
  }
}