{
  "schema_version": 2,
  "id": "jarrydt",
  "name": "Jarryd Tricklebank",
  "location": {
    "city": "Unknown",
    "country": "Unknown"
  },
  "styles": [],
  "links": {
    "source": "https://instagram.com/jarrydt",
    "instagram": "https://instagram.com/jarrydt"
  },
  "tattoos": [],
  "updated_at": "2026-04-26",
  "discovery": {
    "source": "instagram_graph",
    "followed_by_count": 7,
    "similar_to_count": 15,
    "evidence_count": 21,
    "followed_by_known_artists": [
      "_kirilo",
      "_wilddogs_",
      "_yakisoba_",
      "aber_tattooer",
      "abigailrosetattoo",
      "adamdowningtattoo",
      "adamrosenthaltattoo"
    ],
    "similar_to_known_artists": [
      "_yakisoba_",
      "adrian_hing_tattoo",
      "ben__fraser",
      "benjamin.hastings",
      "bobxtate",
      "capillitupou",
      "chingyfringe",
      "chriscashmore",
      "damonstokes_tfy",
      "demi.iacopetta",
      "dvlewintertvttoos",
      "edtaemets",
      "elizabethhuxleymay",
      "haydenoconnor",
      "hughsheldontattoo"
    ],
    "instagram_id": "1801721"
  }
}