{
  "schema_version": 2,
  "id": "tatuagemsorocaba",
  "name": "⚜️ Caê Dias  💀  Old Skull Tattoo ⚜️",
  "location": {
    "city": "Unknown",
    "country": "Unknown"
  },
  "styles": [],
  "links": {
    "source": "https://instagram.com/tatuagemsorocaba",
    "instagram": "https://instagram.com/tatuagemsorocaba"
  },
  "tattoos": [],
  "updated_at": "2026-04-26",
  "discovery": {
    "source": "instagram_graph",
    "followed_by_count": 0,
    "similar_to_count": 3,
    "evidence_count": 3,
    "followed_by_known_artists": [],
    "similar_to_known_artists": [
      "buenotattooer",
      "calledatattoo",
      "house67tattoo"
    ],
    "instagram_id": "299914660"
  }
}