{
  "schema_version": 2,
  "id": "nexustattooestudio",
  "name": "Nexus Tattoo Estúdio",
  "location": {
    "city": "Unknown",
    "country": "Unknown"
  },
  "styles": [],
  "links": {
    "source": "https://instagram.com/nexustattooestudio",
    "instagram": "https://instagram.com/nexustattooestudio"
  },
  "tattoos": [],
  "updated_at": "2026-04-26",
  "discovery": {
    "source": "instagram_graph",
    "followed_by_count": 0,
    "similar_to_count": 5,
    "evidence_count": 5,
    "followed_by_known_artists": [],
    "similar_to_known_artists": [
      "bagetattoo",
      "baumink",
      "bugstattoo",
      "eduardoreistattoo",
      "gasparitattoo"
    ],
    "instagram_id": "7083459754"
  }
}