{
  "schema_version": 2,
  "id": "natecreeper",
  "name": "Nathan Leyvas",
  "location": {
    "city": "Unknown",
    "country": "Unknown"
  },
  "styles": [],
  "links": {
    "source": "https://instagram.com/natecreeper",
    "instagram": "https://instagram.com/natecreeper"
  },
  "tattoos": [],
  "updated_at": "2026-04-26",
  "discovery": {
    "source": "instagram_graph",
    "followed_by_count": 1,
    "similar_to_count": 5,
    "evidence_count": 6,
    "followed_by_known_artists": [
      "adamguyhays"
    ],
    "similar_to_known_artists": [
      "ablackrabbit",
      "alenachun",
      "anttheelder",
      "codydraws",
      "greensoap"
    ],
    "instagram_id": "48184950646"
  }
}