{
  "schema_version": 2,
  "id": "leon_matut",
  "name": "León Matut | LNS Tattoo",
  "location": {
    "city": "Unknown",
    "country": "Unknown"
  },
  "styles": [],
  "links": {
    "source": "https://instagram.com/leon_matut",
    "instagram": "https://instagram.com/leon_matut"
  },
  "tattoos": [],
  "updated_at": "2026-04-26",
  "discovery": {
    "source": "instagram_graph",
    "followed_by_count": 0,
    "similar_to_count": 10,
    "evidence_count": 10,
    "followed_by_known_artists": [],
    "similar_to_known_artists": [
      "alexdiaz_tattoo",
      "andrastattoo",
      "barbara.tattooer",
      "belmontetattoo",
      "bernitattoo",
      "buffonetti",
      "eani13",
      "estheredelvalley",
      "ferrantorretatts",
      "jac_alonso"
    ],
    "instagram_id": "3056540981"
  }
}