{
  "schema_version": 2,
  "id": "magic_hat_tattoo",
  "name": "Port Huron Tattoo Shop",
  "location": {
    "city": "Unknown",
    "country": "Unknown"
  },
  "styles": [],
  "links": {
    "source": "https://instagram.com/magic_hat_tattoo",
    "instagram": "https://instagram.com/magic_hat_tattoo"
  },
  "tattoos": [],
  "updated_at": "2026-04-26",
  "discovery": {
    "source": "instagram_graph",
    "followed_by_count": 0,
    "similar_to_count": 2,
    "evidence_count": 2,
    "followed_by_known_artists": [],
    "similar_to_known_artists": [
      "celebrity_tattoos",
      "tattoosbycasper"
    ],
    "instagram_id": "43254544703"
  }
}