{
  "schema_version": 2,
  "id": "d.jramlallusingh",
  "name": "Ram lallu Singh D.j",
  "location": {
    "city": "Unknown",
    "country": "Unknown"
  },
  "styles": [],
  "links": {
    "source": "https://instagram.com/d.jramlallusingh",
    "instagram": "https://instagram.com/d.jramlallusingh"
  },
  "tattoos": [],
  "updated_at": "2026-04-26",
  "discovery": {
    "source": "instagram_graph",
    "followed_by_count": 0,
    "similar_to_count": 11,
    "evidence_count": 11,
    "followed_by_known_artists": [],
    "similar_to_known_artists": [
      "alanramireztattooartist",
      "alessandro.raggi_tattooist",
      "alexandretattooer",
      "andrea_reinoso",
      "andreichernovalov",
      "appink_official",
      "arango_art",
      "arkotrece",
      "artistink_birkenfeld",
      "belcru",
      "boundbydesign"
    ],
    "instagram_id": "71418387948"
  }
}