{
  "schema_version": 2,
  "id": "arthurlopestatoo",
  "name": "🅰️ ARTHUR LOPES",
  "location": {
    "city": "Unknown",
    "country": "Unknown"
  },
  "styles": [],
  "links": {
    "source": "https://instagram.com/arthurlopestatoo",
    "instagram": "https://instagram.com/arthurlopestatoo"
  },
  "tattoos": [],
  "updated_at": "2026-04-26",
  "discovery": {
    "source": "instagram_graph",
    "followed_by_count": 1,
    "similar_to_count": 1,
    "evidence_count": 2,
    "followed_by_known_artists": [
      "a.ptattoos"
    ],
    "similar_to_known_artists": [
      "emporiotattoo"
    ],
    "instagram_id": "1232656929"
  }
}