{
  "schema_version": 2,
  "id": "tattoosbyciaranicole",
  "name": "Ciara Nicole 🌙",
  "location": {
    "city": "Unknown",
    "country": "Unknown"
  },
  "styles": [],
  "links": {
    "source": "https://instagram.com/tattoosbyciaranicole",
    "instagram": "https://instagram.com/tattoosbyciaranicole"
  },
  "tattoos": [],
  "updated_at": "2026-04-26",
  "discovery": {
    "source": "instagram_graph",
    "followed_by_count": 1,
    "similar_to_count": 2,
    "evidence_count": 3,
    "followed_by_known_artists": [
      "_tsites_"
    ],
    "similar_to_known_artists": [
      "freshtattoos",
      "ink_by_erin"
    ],
    "instagram_id": "201915087"
  }
}