{
  "schema_version": 2,
  "id": "onewaytattoostudio",
  "name": "One Way Tattoo Studio",
  "location": {
    "city": "Unknown",
    "country": "Unknown"
  },
  "styles": [],
  "links": {
    "source": "https://instagram.com/onewaytattoostudio",
    "instagram": "https://instagram.com/onewaytattoostudio"
  },
  "tattoos": [],
  "updated_at": "2026-04-26",
  "discovery": {
    "source": "instagram_graph",
    "followed_by_count": 1,
    "similar_to_count": 2,
    "evidence_count": 3,
    "followed_by_known_artists": [
      "abstract_tattoo"
    ],
    "similar_to_known_artists": [
      "fabio_pepper_tattooer",
      "giuli.pigna.tattooer"
    ],
    "instagram_id": "2714625"
  }
}