{
  "schema_version": 2,
  "id": "janayameihla",
  "name": "Janayameihla| online coach",
  "location": {
    "city": "Unknown",
    "country": "Unknown"
  },
  "styles": [],
  "links": {
    "source": "https://instagram.com/janayameihla",
    "instagram": "https://instagram.com/janayameihla"
  },
  "tattoos": [],
  "updated_at": "2026-04-26",
  "discovery": {
    "source": "instagram_graph",
    "followed_by_count": 2,
    "similar_to_count": 0,
    "evidence_count": 2,
    "followed_by_known_artists": [
      "_kindamo_",
      "abievetattoo"
    ],
    "similar_to_known_artists": [],
    "instagram_id": "47716810"
  }
}