{
  "schema_version": 2,
  "id": "jonatanvalles",
  "name": "Tatuador 🔸 Artista Plástico",
  "location": {
    "city": "Valencia",
    "country": "Venezuela"
  },
  "styles": [],
  "links": {
    "source": "https://www.tattoofilter.com/artists/jonatanvalles",
    "instagram": "https://www.instagram.com/daliart.tattoo./",
    "website": "https://plus.google.com/communities/109122987850631167221"
  },
  "tattoos": [
    {
      "image_id": "001",
      "image_full": "https://img.thetattoo.world/artists/jonatanvalles/full/001.webp",
      "image_thumb": "https://img.thetattoo.world/artists/jonatanvalles/thumb/001.webp",
      "analysis": {
        "themes": [],
        "dominant_colours": [],
        "body_parts": [],
        "size_category": null,
        "confidence_score": null
      }
    },
    {
      "image_id": "002",
      "image_full": "https://img.thetattoo.world/artists/jonatanvalles/full/002.webp",
      "image_thumb": "https://img.thetattoo.world/artists/jonatanvalles/thumb/002.webp",
      "analysis": {
        "themes": [],
        "dominant_colours": [],
        "body_parts": [],
        "size_category": null,
        "confidence_score": null
      }
    },
    {
      "image_id": "003",
      "image_full": "https://img.thetattoo.world/artists/jonatanvalles/full/003.webp",
      "image_thumb": "https://img.thetattoo.world/artists/jonatanvalles/thumb/003.webp",
      "analysis": {
        "themes": [],
        "dominant_colours": [],
        "body_parts": [],
        "size_category": null,
        "confidence_score": null
      }
    }
  ],
  "updated_at": "2026-03-29",
  "bio": "WORKPLACE Once Tattoo Studio Valencia\n\n🔸Valencia.",
  "instagram_enriched": {
    "id": null,
    "follower_count": null,
    "following_count": null,
    "media_count": null,
    "following": []
  }
}
