{
  "schema_version": 2,
  "id": "cindy_von_allemeinefarben",
  "name": "Cindy_von_AlleMeineFarben",
  "location": {
    "city": "Unknown",
    "country": "Unknown"
  },
  "styles": [],
  "links": {
    "source": "https://instagram.com/cindy_von_allemeinefarben",
    "instagram": "https://instagram.com/cindy_von_allemeinefarben"
  },
  "tattoos": [],
  "updated_at": "2026-04-26",
  "discovery": {
    "source": "instagram_graph",
    "followed_by_count": 0,
    "similar_to_count": 4,
    "evidence_count": 4,
    "followed_by_known_artists": [],
    "similar_to_known_artists": [
      "deepshadingstattoo_kev",
      "farbschock",
      "feinkunsttattoo",
      "heavenofcolours"
    ],
    "instagram_id": "215497754"
  }
}