{
  "schema_version": 2,
  "id": "studio100tattoo",
  "name": "Studio 100",
  "location": {
    "city": "Unknown",
    "country": "Unknown"
  },
  "styles": [],
  "links": {
    "source": "https://instagram.com/studio100tattoo",
    "instagram": "https://instagram.com/studio100tattoo"
  },
  "tattoos": [],
  "updated_at": "2026-04-26",
  "discovery": {
    "source": "instagram_graph",
    "followed_by_count": 0,
    "similar_to_count": 2,
    "evidence_count": 2,
    "followed_by_known_artists": [],
    "similar_to_known_artists": [
      "alish_p",
      "emmawillistattoos"
    ],
    "instagram_id": "9601197993"
  }
}