{
  "schema_version": 2,
  "id": "massimiliano_tattooist",
  "name": "massimiliano_tattooist",
  "location": {
    "city": "London",
    "country": "United Kingdom"
  },
  "styles": [
    "dotwork",
    "fineline"
  ],
  "links": {
    "source": "https://tattooswizard.com/artists/massimiliano_tattooist",
    "instagram": "https://www.instagram.com/massimiliano_tattooist/",
    "website": "https://www.wizard.tattoo/"
  },
  "tattoos": [
    {
      "image_id": "001",
      "image_full": "https://img.thetattoo.world/artists/massimiliano_tattooist/full/001.webp",
      "image_thumb": "https://img.thetattoo.world/artists/massimiliano_tattooist/thumb/001.webp",
      "analysis": {
        "themes": [],
        "dominant_colours": [],
        "body_parts": [],
        "size_category": null,
        "confidence_score": null
      }
    },
    {
      "image_id": "002",
      "image_full": "https://img.thetattoo.world/artists/massimiliano_tattooist/full/002.webp",
      "image_thumb": "https://img.thetattoo.world/artists/massimiliano_tattooist/thumb/002.webp",
      "analysis": {
        "themes": [],
        "dominant_colours": [],
        "body_parts": [],
        "size_category": null,
        "confidence_score": null
      }
    },
    {
      "image_id": "003",
      "image_full": "https://img.thetattoo.world/artists/massimiliano_tattooist/full/003.webp",
      "image_thumb": "https://img.thetattoo.world/artists/massimiliano_tattooist/thumb/003.webp",
      "analysis": {
        "themes": [],
        "dominant_colours": [],
        "body_parts": [],
        "size_category": null,
        "confidence_score": null
      }
    },
    {
      "image_id": "004",
      "image_full": "https://img.thetattoo.world/artists/massimiliano_tattooist/full/004.webp",
      "image_thumb": "https://img.thetattoo.world/artists/massimiliano_tattooist/thumb/004.webp",
      "analysis": {
        "themes": [],
        "dominant_colours": [],
        "body_parts": [],
        "size_category": null,
        "confidence_score": null
      }
    },
    {
      "image_id": "005",
      "image_full": "https://img.thetattoo.world/artists/massimiliano_tattooist/full/005.webp",
      "image_thumb": "https://img.thetattoo.world/artists/massimiliano_tattooist/thumb/005.webp",
      "analysis": {
        "themes": [],
        "dominant_colours": [],
        "body_parts": [],
        "size_category": null,
        "confidence_score": null
      }
    },
    {
      "image_id": "006",
      "image_full": "https://img.thetattoo.world/artists/massimiliano_tattooist/full/006.webp",
      "image_thumb": "https://img.thetattoo.world/artists/massimiliano_tattooist/thumb/006.webp",
      "analysis": {
        "themes": [],
        "dominant_colours": [],
        "body_parts": [],
        "size_category": null,
        "confidence_score": null
      }
    },
    {
      "image_id": "007",
      "image_full": "https://img.thetattoo.world/artists/massimiliano_tattooist/full/007.webp",
      "image_thumb": "https://img.thetattoo.world/artists/massimiliano_tattooist/thumb/007.webp",
      "analysis": {
        "themes": [],
        "dominant_colours": [],
        "body_parts": [],
        "size_category": null,
        "confidence_score": null
      }
    },
    {
      "image_id": "008",
      "image_full": "https://img.thetattoo.world/artists/massimiliano_tattooist/full/008.webp",
      "image_thumb": "https://img.thetattoo.world/artists/massimiliano_tattooist/thumb/008.webp",
      "analysis": {
        "themes": [],
        "dominant_colours": [],
        "body_parts": [],
        "size_category": null,
        "confidence_score": null
      }
    },
    {
      "image_id": "009",
      "image_full": "https://img.thetattoo.world/artists/massimiliano_tattooist/full/009.webp",
      "image_thumb": "https://img.thetattoo.world/artists/massimiliano_tattooist/thumb/009.webp",
      "analysis": {
        "themes": [],
        "dominant_colours": [],
        "body_parts": [],
        "size_category": null,
        "confidence_score": null
      }
    }
  ],
  "updated_at": "2026-03-28",
  "bio": "Massimiliano is a highly skilled tattoo artist specializing in the intricate styles of dotwork and fineline tattoos. Known for their impeccable professionalism, they have made a name for themselves in London's vibrant tattoo scene. Clients can find Massimiliano's stunning work at Super Queen Tattoo and Next Chapter Tattoo Studio, where they can expect to receive top-tier artistry.\nPrice: $\nCurrent location: London, England, United Kingdom\n\nTattoo Artist \n15 years experience\nFine line, black and gray realistic \nBased in London \n@nextchaptertattoostudio\n@kinkyinktattoo",
  "instagram_enriched": {
    "id": "32818747340",
    "follower_count": 1385,
    "following_count": 1109,
    "media_count": 276,
    "following": [],
    "profile_pic_url": "https://img.thetattoo.world/artists/massimiliano_tattooist/instagram/profile.jpg"
  }
}
