{
  "schema_version": 2,
  "id": "drmorsetattoo",
  "name": "Dr Morse Tattoo Studio",
  "location": {
    "city": "Unknown",
    "country": "Unknown"
  },
  "styles": [],
  "links": {
    "source": "https://instagram.com/drmorsetattoo",
    "instagram": "https://instagram.com/drmorsetattoo"
  },
  "tattoos": [],
  "updated_at": "2026-04-26",
  "discovery": {
    "source": "instagram_graph",
    "followed_by_count": 0,
    "similar_to_count": 6,
    "evidence_count": 6,
    "followed_by_known_artists": [],
    "similar_to_known_artists": [
      "acee.tattoos",
      "beksi_tattoos",
      "bryn_goodall",
      "carlotta_verduci",
      "craigy_lee",
      "ebony_mellowship"
    ],
    "instagram_id": "208207954"
  }
}