{
  "schema_version": 2,
  "id": "thetengu.tattoo",
  "name": "ＴｈｅＴｅｎｇｕ",
  "location": {
    "city": "Unknown",
    "country": "Unknown"
  },
  "styles": [],
  "links": {
    "source": "https://instagram.com/thetengu.tattoo",
    "instagram": "https://instagram.com/thetengu.tattoo"
  },
  "tattoos": [],
  "updated_at": "2026-04-26",
  "discovery": {
    "source": "instagram_graph",
    "followed_by_count": 0,
    "similar_to_count": 2,
    "evidence_count": 2,
    "followed_by_known_artists": [],
    "similar_to_known_artists": [
      "gaia_magnani_tattooartist",
      "giuppotattoo"
    ],
    "instagram_id": "274645000"
  }
}