{
  "schema_version": 2,
  "id": "staciejascott",
  "name": "Stacie Jascott /Olympia Tattooer",
  "location": {
    "city": "Unknown",
    "country": "Unknown"
  },
  "styles": [],
  "links": {
    "source": "https://instagram.com/staciejascott",
    "instagram": "https://instagram.com/staciejascott"
  },
  "tattoos": [],
  "updated_at": "2026-04-26",
  "discovery": {
    "source": "instagram_graph",
    "followed_by_count": 3,
    "similar_to_count": 0,
    "evidence_count": 3,
    "followed_by_known_artists": [
      "abehammytats",
      "adamdowningtattoo",
      "adamrosenthaltattoo"
    ],
    "similar_to_known_artists": [],
    "instagram_id": "9967080"
  }
}